{"assurances":{"catalog_and_dataset_state_preserved":true,"network_request_performed":false,"private_or_live_capability_used":false,"production_catalog_selector_exercised":true,"retained_market_store_accessed_read_only":true,"selection_receipts_verified":true},"bindings":{"catalog_content_sha256":"91bc7695737585b6bb1f36af159d03d6a4aeb1e8debc506bffcf023e4ce0c20e","catalog_result_artifact_sha256":"c36612505d1b07f50ae6092efe4a158129ced9f25832e2f9a757924a514366d0","catalog_result_content_sha256":"5836c774e353f6deaae7e5642c8390a45dea7a66f396944ae45f46a2def858f8","catalog_revision":5,"implementation_identity":"git:377830046cf51440ebbdd2caad0c2919f09b45f9","selection_chain_sha256":"42a45c427d643fdff2b16000ded91386cebdb416734b7a2ba1ae9fde165f2502"},"configuration":{"concurrency":4,"request_count":4,"selection_pass_count":2},"content_sha256":"4622399e6b902d84e318c66d5e60c35584238bfdd278a5bfb3d2b33238c71040","correctness":{"catalog_verified_after_measurement":true,"deterministic_repeat_equal":true,"selected_dataset_count":978,"selected_object_count":978,"selected_row_count":30832334,"selected_size_bytes":529794759,"selection_fingerprint_sha256":"c5ab1862d07be6d20f3727b7250b7f0d424f4ef67c7f3f59c57cd06824b91556","state_fingerprint_equal_before_after":true,"topology_segment_count":2},"environment":{"cache_state":"uncontrolled-first-then-immediate-repeat","duckdb_version":"1.5.5","logical_cpu_count":12,"memory_total_bytes":16476225536,"platform_machine":"AMD64","platform_system":"Windows","pyarrow_version":"25.0.1","python_version":"3.14.0"},"evidence_schema":"grid.phase2-full-history-catalog-performance/v1","generated_at_utc":"2026-08-14T13:28:12.683908Z","limitations":["The measurement covers the retained five-instrument candle campaign, not a future 700-instrument corpus.","The first pass has uncontrolled host cache state; the second is an immediate repeat.","This component measurement does not define or qualify the owner-reviewed full-history end-to-end performance envelope.","This evidence does not accept coverage or lifecycle reasons, close Gate 2, authorize Phase 3, or enable live execution."],"measurement":{"first_pass_rows_per_second":1382160,"first_pass_wall_elapsed_ns":22307350800,"first_pass_worker_elapsed_sum_ns":80943551100,"repeat_pass_rows_per_second":1365683,"repeat_pass_wall_elapsed_ns":22576478100,"repeat_pass_worker_elapsed_sum_ns":80272504800},"status":"measured-full-history-catalog-selection","storage_policy":{"evidence_contains_account_data":false,"evidence_contains_dataset_or_instrument_identities":false,"evidence_contains_market_values":false,"evidence_contains_request_time_bounds":false,"evidence_contains_runtime_paths":false,"runtime_catalog_or_market_artifacts_committed_to_git":false}}
